{
  "schema_version": 1,
  "submission_id": "wb001-baseline-xz-9e-v2",
  "workbench": {"id": "WB-001", "version": "0.2.0"},
  "candidate": {
    "name": "reference XZ preset 9 extreme",
    "version": "1.0.0",
    "protocol": "wb001-batch-v1",
    "command": ["{python}", "codec_adapter.py", "--profile", "xz-9e"],
    "source_files": ["codec_adapter.py", "profiles.json"],
    "deterministic": true
  },
  "method": {"summary": "XZ container, LZMA2 preset 9 extreme, CRC64.", "license": "reference-runtime licenses apply"}
}
