{
  "schema_version": 1,
  "submission_id": "wb001-baseline-brotli-5-v2",
  "workbench": {"id": "WB-001", "version": "0.2.0"},
  "candidate": {
    "name": "reference Brotli quality 5",
    "version": "1.0.0",
    "protocol": "wb001-batch-v1",
    "command": ["{python}", "codec_adapter.py", "--profile", "brotli-5"],
    "source_files": ["codec_adapter.py", "profiles.json"],
    "deterministic": true
  },
  "method": {"summary": "Brotli generic mode, quality 5, lgwin 22.", "license": "reference-runtime licenses apply"}
}
